{
  "schema_version": "3.2-b.1",
  "run_id": "run-gold-0001",
  "task_id": "task-dog-0001",
  "dataset": "locomo",
  "dataset_identity": {
    "dataset": "locomo",
    "dataset_version": "phase2-umr-fixture-v1"
  },
  "condition": "GOLD_EVIDENCE",
  "configuration_identity": {
    "reasoning_model": "not_pinned_yet_3.2-b_placeholder",
    "note": "Condition B (gold-evidence control) per EVALUATION_CONTRACT.md section 5."
  },
  "agent_visible_input_ref": "fixtures/gold_evidence/agent_visible_context.json",
  "execution_result_ref": "fixtures/gold_evidence/agent_execution_result.json",
  "trace_ref": "fixtures/gold_evidence/trace_artifact.json",
  "evaluator_reference_ref": "fixtures/gold_evidence/evaluator_reference.json",
  "evaluation_result_ref": "fixtures/gold_evidence/evaluation_result.json",
  "created_at": "2026-08-01T00:00:00Z"
}
